ID,Usuario,CUIL_Cliente,Fecha,Caso,Descripción,Estado,Prioridad,Tipo de Riesgo,Canal de Detección,Monto Sospechoso (ARS),Observaciones
794,analista2,81391345591,2023-09-05,CASO-00794,Ex dolor doloribus laboriosam porro fugiat.,Finalizado,Alta,Ingeniería Social,App Móvil,233361,Magnam quaerat et inventore.
795,analista1,21368283200,2023-09-09,CASO-00795,Recusandae nostrum occaecati mollitia.,Finalizado,Media,Dispositivo Nuevo,Web Corporativa,1017185,Ducimus commodi pariatur.
796,analista1,98956805378,2023-09-25,CASO-00796,Aperiam pariatur quibusdam deleniti fugiat sint.,Pendiente,Alta,Ingeniería Social,Banca Web,368611,Aspernatur qui perspiciatis.
797,analista3,58170810100,2023-09-16,CASO-00797,Assumenda dolorum deserunt.,Pendiente,Baja,Acceso Ilegítimo,Correo Electrónico,304643,Omnis ratione modi.
798,analista1,24968923822,2023-09-16,CASO-00798,Quos quibusdam reprehenderit.,En revisión,Baja,Dispositivo Nuevo,Web Corporativa,1037365,Tenetur libero error totam.
799,analista1,31728719931,2023-09-08,CASO-00799,Reprehenderit voluptatum exercitationem at commodi.,En revisión,Alta,Transaccional,App Móvil,740386,Aut molestiae officia ab.
800,analista1,41488791739,2023-09-10,CASO-00800,Sapiente quis ex.,Finalizado,Media,Acceso Ilegítimo,Web Corporativa,924987,Eligendi ab magnam.
801,analista1,93101744177,2023-09-21,CASO-00801,Occaecati harum vitae deserunt deserunt.,En revisión,Media,Dispositivo Nuevo,Correo Electrónico,136023,Doloremque alias esse ipsum.
802,analista1,2417178847,2023-09-16,CASO-00802,Tempora a veniam recusandae doloribus.,En revisión,Baja,Transaccional,Banca Web,122191,Soluta vitae unde fugit.
803,analista1,616989887,2023-09-14,CASO-00803,Voluptatibus voluptatibus inventore.,En revisión,Alta,Transaccional,App Móvil,440585,Voluptate tempora ad.
804,analista3,54736186448,2023-09-16,CASO-00804,Illum fugiat porro sit delectus.,En revisión,Baja,Transaccional,Banca Web,1121419,Omnis et est tempora.
805,analista2,11377012638,2023-10-16,CASO-00805,Animi officiis totam neque quod qui.,Finalizado,Baja,Acceso Ilegítimo,App Móvil,624629,Tempore ad repellendus.
806,analista1,7042042247,2023-10-10,CASO-00806,Magnam facilis error deleniti molestiae.,En revisión,Baja,Acceso Ilegítimo,Web Corporativa,425243,Atque eaque beatae animi.
807,analista3,20033878360,2023-10-25,CASO-00807,Dolore illum repellendus suscipit.,Pendiente,Media,Transaccional,Web Corporativa,173654,Quas possimus amet.
808,analista2,86636839786,2023-10-05,CASO-00808,Consequuntur ad ad autem laborum.,Pendiente,Alta,Dispositivo Nuevo,Banca Web,338902,Quod rem quis.
809,analista3,53021627679,2023-10-18,CASO-00809,Officia molestiae accusamus mollitia reprehenderit.,Pendiente,Baja,Dispositivo Nuevo,App Móvil,131290,Pariatur laudantium ipsa eum.
810,analista2,72683167382,2023-10-17,CASO-00810,Quas eos et.,En revisión,Baja,Transaccional,Web Corporativa,664971,Omnis incidunt facilis.
811,analista1,89032292116,2023-10-18,CASO-00811,Illo non voluptatibus ad.,Finalizado,Alta,Acceso Ilegítimo,Web Corporativa,254682,Ipsam quos quia at quia.
812,analista1,70404915672,2023-10-17,CASO-00812,Quos voluptatem quam.,En revisión,Baja,Ingeniería Social,Correo Electrónico,172957,Sapiente id in ab.
813,analista1,15175217707,2023-10-22,CASO-00813,Eveniet ducimus quisquam saepe amet.,Finalizado,Media,Ingeniería Social,Web Corporativa,313183,Corporis velit labore omnis.
814,analista2,53709016860,2023-10-14,CASO-00814,Libero magnam id.,En revisión,Media,Acceso Ilegítimo,Banca Web,523116,Quod deserunt ipsam illum.
815,analista1,51524804790,2023-10-10,CASO-00815,Amet illum sunt.,En revisión,Alta,Transaccional,Correo Electrónico,767538,Quibusdam voluptatibus autem.
816,analista2,2198410744,2023-10-24,CASO-00816,Suscipit vitae quisquam.,Finalizado,Alta,Ingeniería Social,Web Corporativa,586743,Ullam neque optio voluptas.
817,analista2,65450820308,2023-10-21,CASO-00817,Ratione cumque eum pariatur.,Pendiente,Baja,Dispositivo Nuevo,Web Corporativa,103019,Aut nam tempore commodi.
818,analista1,74410801114,2023-10-19,CASO-00818,Unde dicta ex exercitationem maiores natus.,Finalizado,Baja,Acceso Ilegítimo,Web Corporativa,366074,Deleniti cumque nobis.
819,analista1,74908588315,2023-10-13,CASO-00819,Nesciunt mollitia incidunt necessitatibus omnis.,Pendiente,Media,Acceso Ilegítimo,App Móvil,576161,Sit voluptatibus architecto.
820,analista2,14365701683,2023-10-01,CASO-00820,Consequatur explicabo officia nihil ipsa.,En revisión,Baja,Acceso Ilegítimo,App Móvil,201745,Facere qui amet unde.
821,analista3,55876317564,2023-10-08,CASO-00821,Placeat ea aperiam repellat delectus.,En revisión,Baja,Acceso Ilegítimo,App Móvil,296892,Atque provident a ducimus.
822,analista3,85528908378,2023-10-17,CASO-00822,Velit fugiat animi libero sit.,Pendiente,Alta,Transaccional,Correo Electrónico,389380,Officia aliquam voluptate.
823,analista1,20983177676,2023-10-02,CASO-00823,Ipsum debitis quasi.,Finalizado,Media,Transaccional,Correo Electrónico,123001,Deserunt fugiat dolor quas.
824,analista2,33722614840,2023-10-09,CASO-00824,Provident mollitia eius quam veritatis.,En revisión,Baja,Ingeniería Social,Banca Web,592840,Numquam aperiam culpa illo.
825,analista2,82229902173,2023-10-12,CASO-00825,Officia repellat et modi sed dolor.,Finalizado,Alta,Dispositivo Nuevo,Web Corporativa,613877,Nam assumenda veritatis.
826,analista3,5196907559,2023-10-20,CASO-00826,Cumque earum molestiae dolorem.,Pendiente,Alta,Acceso Ilegítimo,App Móvil,582784,Modi saepe esse aut.
827,analista3,68792167055,2023-10-27,CASO-00827,Libero quaerat voluptatem eum cumque.,Pendiente,Media,Acceso Ilegítimo,Web Corporativa,946751,Odit deserunt cum culpa.
828,analista3,79551779401,2023-10-25,CASO-00828,Id itaque cupiditate voluptas.,Finalizado,Baja,Ingeniería Social,App Móvil,660747,Autem explicabo ex.
829,analista2,90391664254,2023-10-16,CASO-00829,Soluta optio blanditiis autem.,En revisión,Media,Acceso Ilegítimo,Web Corporativa,361078,Possimus harum assumenda.
830,analista3,57526416057,2023-10-06,CASO-00830,Enim culpa error libero.,En revisión,Baja,Acceso Ilegítimo,App Móvil,63551,Commodi ipsam ea enim.
831,analista1,2083682695,2023-10-24,CASO-00831,Inventore eveniet assumenda.,Pendiente,Media,Acceso Ilegítimo,Correo Electrónico,835040,At qui magnam consequatur.
832,analista2,67232013654,2023-10-03,CASO-00832,Consequatur in omnis quis quam.,Pendiente,Alta,Transaccional,Web Corporativa,815107,Atque quia natus quibusdam.
833,analista3,6775280509,2023-10-07,CASO-00833,Quam iure maxime assumenda dolore a.,Pendiente,Baja,Dispositivo Nuevo,App Móvil,1062909,Adipisci magni ipsam facilis.
834,analista1,58360048485,2023-10-17,CASO-00834,Ea omnis consectetur adipisci aut delectus.,Pendiente,Alta,Acceso Ilegítimo,Banca Web,832567,Placeat ab atque.
835,analista2,25650550297,2023-10-23,CASO-00835,Possimus totam necessitatibus repellat officiis.,Pendiente,Alta,Acceso Ilegítimo,Correo Electrónico,540213,Ullam ipsam nam.
836,analista3,51350368229,2023-10-18,CASO-00836,Ratione atque doloremque nemo vitae reiciendis.,Pendiente,Alta,Dispositivo Nuevo,App Móvil,935319,Excepturi voluptate ipsa.
837,analista3,21074236814,2023-10-07,CASO-00837,Doloremque eum iure provident exercitationem tempora.,En revisión,Media,Transaccional,Banca Web,248141,Fugit et vitae maxime.
838,analista1,9117643212,2023-10-21,CASO-00838,Porro reiciendis nisi.,En revisión,Baja,Acceso Ilegítimo,Web Corporativa,1009328,Sed accusamus occaecati.
839,analista3,26749051658,2023-10-25,CASO-00839,Repellendus mollitia reiciendis.,Pendiente,Baja,Acceso Ilegítimo,App Móvil,282794,Quas facere ut quasi.
840,analista3,60614133890,2023-10-23,CASO-00840,Tempore sunt molestias fugit sapiente.,Pendiente,Alta,Acceso Ilegítimo,App Móvil,313292,Omnis iure asperiores.
841,analista3,51089892980,2023-10-18,CASO-00841,Et ducimus adipisci voluptatum voluptatibus architecto.,Finalizado,Media,Dispositivo Nuevo,Web Corporativa,1132364,Veritatis minima cupiditate.
842,analista3,40288984422,2023-10-22,CASO-00842,Impedit expedita possimus quod.,Pendiente,Media,Ingeniería Social,App Móvil,683135,Modi fugiat ut fuga.
843,analista2,21154659367,2023-10-11,CASO-00843,Dolorem perferendis laborum dignissimos ratione necessitatibus.,Finalizado,Media,Transaccional,Web Corporativa,401920,Est fugiat corrupti ut eaque.
844,analista2,98664781502,2023-10-15,CASO-00844,Doloribus beatae ullam ab numquam.,Pendiente,Baja,Ingeniería Social,Banca Web,69761,Est ullam vel perspiciatis.
845,analista1,20524662751,2023-10-13,CASO-00845,Architecto dolor libero.,Finalizado,Baja,Acceso Ilegítimo,Correo Electrónico,1010384,Animi aliquid debitis.
846,analista3,89240039292,2023-10-23,CASO-00846,Illum quaerat quasi exercitationem.,Finalizado,Alta,Acceso Ilegítimo,Correo Electrónico,1073647,Nemo qui aspernatur voluptas.
847,analista2,53209058408,2023-10-13,CASO-00847,Rerum quasi consequuntur hic atque beatae.,En revisión,Baja,Acceso Ilegítimo,App Móvil,1081318,Ipsa amet nam qui aut.
848,analista2,85737712876,2023-10-18,CASO-00848,Quas aliquam molestias sit.,Finalizado,Alta,Dispositivo Nuevo,Web Corporativa,959530,Laudantium consequatur quod.
849,analista1,45471498474,2023-10-01,CASO-00849,Provident ab voluptate laborum.,Finalizado,Alta,Ingeniería Social,Banca Web,136068,Quod eum possimus ad.
850,analista3,88573545916,2023-10-24,CASO-00850,Odio accusantium enim eius.,Finalizado,Media,Transaccional,Correo Electrónico,482459,Quo saepe sed.
851,analista3,50114941322,2023-10-03,CASO-00851,Beatae voluptatibus quod ex quam.,Finalizado,Baja,Ingeniería Social,Banca Web,1183937,Quas laboriosam nulla atque.
852,analista1,85464104632,2023-10-10,CASO-00852,Esse modi magnam ea ex veritatis.,Finalizado,Baja,Dispositivo Nuevo,Banca Web,1183808,Officiis et id nemo.
853,analista3,70330355853,2023-10-27,CASO-00853,Dicta quam aliquid.,Pendiente,Media,Ingeniería Social,Banca Web,1088107,Optio est tenetur nihil.
854,analista1,1454144871,2023-10-26,CASO-00854,Cum expedita repellat dolores incidunt blanditiis.,Pendiente,Baja,Dispositivo Nuevo,Banca Web,442814,Debitis labore sunt expedita.
855,analista1,85530525578,2023-10-28,CASO-00855,Animi neque unde cum ipsam.,En revisión,Baja,Acceso Ilegítimo,App Móvil,671657,Aspernatur porro quas.
856,analista2,25939949919,2023-10-14,CASO-00856,Molestias eligendi excepturi nostrum itaque ad.,En revisión,Media,Acceso Ilegítimo,App Móvil,916088,Provident earum doloribus.
857,analista2,67497643995,2023-10-26,CASO-00857,Ipsa consequatur nulla minus.,Finalizado,Alta,Dispositivo Nuevo,Banca Web,1035446,Vitae esse illum nesciunt.
858,analista3,65115221233,2023-11-06,CASO-00858,Error rerum laborum.,Finalizado,Baja,Acceso Ilegítimo,Web Corporativa,1097702,Sunt ex odit quod.
859,analista1,3286583423,2023-11-01,CASO-00859,Vel placeat omnis labore minima.,Finalizado,Media,Ingeniería Social,App Móvil,1024380,Atque vitae quasi.
860,analista2,20856408160,2023-11-15,CASO-00860,Voluptas dolores quo.,En revisión,Media,Transaccional,Banca Web,1021984,Suscipit dolore minus non.
861,analista2,26896629621,2023-11-26,CASO-00861,Qui aut molestiae ipsa commodi.,Finalizado,Alta,Dispositivo Nuevo,Correo Electrónico,1080446,Eligendi dicta ipsum natus.
862,analista2,65385150887,2023-11-16,CASO-00862,Quam ullam nisi perspiciatis iusto.,Finalizado,Baja,Transaccional,Web Corporativa,1117351,Dolorum aspernatur suscipit.
863,analista3,74223481553,2023-11-10,CASO-00863,Animi vitae cupiditate est culpa harum.,Pendiente,Media,Acceso Ilegítimo,App Móvil,537134,Nulla error placeat ipsum.
864,analista2,37647106082,2023-11-04,CASO-00864,Amet quo recusandae illo adipisci.,Pendiente,Baja,Acceso Ilegítimo,Banca Web,719412,Totam nobis nulla officia.
865,analista2,4703048470,2023-11-01,CASO-00865,Quaerat reiciendis esse nostrum esse sit.,Pendiente,Alta,Acceso Ilegítimo,Correo Electrónico,828456,Placeat cum aut sit.
866,analista2,12368479430,2023-11-05,CASO-00866,Delectus adipisci molestiae officia.,En revisión,Alta,Ingeniería Social,App Móvil,567198,Molestiae nulla nulla.
867,analista2,62540913989,2023-11-13,CASO-00867,Cupiditate quod modi vitae inventore repellat.,Finalizado,Media,Transaccional,Correo Electrónico,958781,Deleniti iusto quos.
868,analista2,35428669698,2023-11-22,CASO-00868,Cumque iure aperiam quas eius.,Finalizado,Media,Dispositivo Nuevo,Correo Electrónico,272736,Ducimus numquam qui expedita.
869,analista2,14162645274,2023-11-09,CASO-00869,Omnis occaecati fuga hic molestias aspernatur.,Pendiente,Alta,Transaccional,Banca Web,1197393,Pariatur sequi cum tempora.
870,analista1,64615421001,2023-11-02,CASO-00870,Expedita nihil accusantium ab.,En revisión,Alta,Acceso Ilegítimo,Correo Electrónico,86428,Consequatur ea fuga ullam.
871,analista2,95266450912,2023-11-10,CASO-00871,Accusamus ad sit itaque.,Finalizado,Alta,Ingeniería Social,Correo Electrónico,869512,Blanditiis natus nam.
872,analista3,53907272660,2023-11-22,CASO-00872,Deserunt aperiam eius.,Pendiente,Alta,Dispositivo Nuevo,Correo Electrónico,216159,Ducimus quae fuga architecto.
873,analista2,23169034795,2023-11-23,CASO-00873,Natus cupiditate saepe numquam error officia.,Pendiente,Alta,Acceso Ilegítimo,Banca Web,109009,Ea id reiciendis culpa dolor.
874,analista3,20369313770,2023-11-08,CASO-00874,Amet dolores vel minus saepe.,Finalizado,Baja,Transaccional,Correo Electrónico,158979,Sint sapiente odio.
875,analista3,92218550876,2023-11-26,CASO-00875,Dolorum vitae inventore distinctio blanditiis cumque.,Pendiente,Baja,Dispositivo Nuevo,Correo Electrónico,1146412,Sed consectetur unde.
876,analista1,56083727222,2023-11-26,CASO-00876,Eos laudantium laboriosam laborum.,Pendiente,Baja,Transaccional,Correo Electrónico,178743,Quaerat ex unde sit.
877,analista2,21578676050,2023-11-09,CASO-00877,Eveniet nihil consequatur iste repellendus.,Pendiente,Alta,Acceso Ilegítimo,Correo Electrónico,965381,Iusto ipsum cumque ipsum.
878,analista2,81009282130,2023-11-23,CASO-00878,Nisi dolorum saepe.,Pendiente,Baja,Acceso Ilegítimo,Banca Web,432790,Doloribus aperiam veniam.
879,analista2,17586415801,2023-11-25,CASO-00879,Soluta odit temporibus.,Pendiente,Alta,Acceso Ilegítimo,App Móvil,891452,Odio similique itaque aut.
880,analista1,72685593443,2023-11-25,CASO-00880,Cumque voluptatem veritatis totam.,Finalizado,Media,Ingeniería Social,Correo Electrónico,335740,Pariatur quis atque id animi.
881,analista2,41138129715,2023-11-25,CASO-00881,Ipsa nihil adipisci quae.,Pendiente,Media,Dispositivo Nuevo,App Móvil,665358,Saepe et id sed.
882,analista1,71999565689,2023-11-21,CASO-00882,Repudiandae quam inventore voluptates commodi.,Pendiente,Baja,Acceso Ilegítimo,Banca Web,813892,Quam a esse.
883,analista1,74817640188,2023-11-26,CASO-00883,Saepe minima veritatis optio ex delectus.,En revisión,Alta,Dispositivo Nuevo,App Móvil,565653,Dolores nemo labore iusto.
884,analista1,18492557503,2023-11-09,CASO-00884,Iure provident tempora dicta a eum.,Pendiente,Baja,Ingeniería Social,Web Corporativa,496158,Iste quas doloribus voluptas.
885,analista1,29127343201,2023-11-26,CASO-00885,Commodi natus neque ad.,Finalizado,Alta,Transaccional,App Móvil,1120221,Recusandae natus ex.
886,analista2,91949873450,2023-11-13,CASO-00886,Numquam error sunt nisi possimus vero.,En revisión,Media,Dispositivo Nuevo,Banca Web,1158012,Ut tempore ipsa ducimus.
887,analista3,7314314573,2023-11-05,CASO-00887,Inventore magni vero voluptates debitis.,Finalizado,Baja,Dispositivo Nuevo,Correo Electrónico,417056,Eos quaerat doloremque.
888,analista2,11603502547,2023-11-16,CASO-00888,Doloribus sed eligendi ipsa aut.,En revisión,Alta,Dispositivo Nuevo,Correo Electrónico,408580,Similique ex sed eos.
889,analista2,32257501534,2023-11-16,CASO-00889,Aspernatur possimus distinctio in.,En revisión,Baja,Acceso Ilegítimo,Banca Web,928950,Sapiente occaecati corrupti.
890,analista2,21791062011,2023-11-18,CASO-00890,Possimus vero perspiciatis totam.,Finalizado,Media,Acceso Ilegítimo,Correo Electrónico,52406,Voluptatibus tempore iste.
891,analista1,35225483106,2023-11-18,CASO-00891,Aliquid sequi cumque omnis ad odio.,Finalizado,Baja,Ingeniería Social,Correo Electrónico,214519,Maxime iure officia.
892,analista3,18224545276,2023-11-10,CASO-00892,Iusto aliquam deleniti quae.,En revisión,Baja,Acceso Ilegítimo,Web Corporativa,759598,Voluptate nisi ipsa.
893,analista3,58468630609,2023-12-13,CASO-00893,Sapiente velit accusantium.,Finalizado,Alta,Ingeniería Social,Correo Electrónico,308700,Minima alias repellat.
894,analista1,70535601390,2023-12-02,CASO-00894,Voluptatum hic nam accusantium quidem distinctio.,Finalizado,Media,Ingeniería Social,Web Corporativa,362927,Ad eligendi est minus.
895,analista1,45169417586,2023-12-16,CASO-00895,Itaque neque aut.,Finalizado,Media,Transaccional,Web Corporativa,900363,Expedita sunt autem ea.
896,analista1,40859411033,2023-12-20,CASO-00896,Modi voluptatum tempore praesentium nesciunt.,Finalizado,Baja,Acceso Ilegítimo,Banca Web,892352,Est magnam itaque nesciunt.
897,analista2,78739409127,2023-12-21,CASO-00897,Eaque asperiores saepe quisquam occaecati earum.,Finalizado,Baja,Transaccional,Web Corporativa,979799,Placeat sint ratione ex.
898,analista1,98711584410,2023-12-19,CASO-00898,Laborum ab necessitatibus est.,En revisión,Alta,Acceso Ilegítimo,Web Corporativa,122313,Voluptate ratione porro ex.
899,analista2,84142189001,2023-12-26,CASO-00899,Odit aspernatur eaque cumque tempora.,Finalizado,Media,Dispositivo Nuevo,Web Corporativa,169887,Minus officiis cum.
900,analista3,38919800378,2023-12-08,CASO-00900,Earum quas fugit dolorem nulla.,Pendiente,Alta,Transaccional,Web Corporativa,535828,Omnis et deleniti.
901,analista1,52251401955,2023-12-25,CASO-00901,Molestiae doloribus tempora minus quod autem.,En revisión,Alta,Ingeniería Social,Banca Web,406834,Praesentium quam magni est.
902,analista2,85184017651,2023-12-08,CASO-00902,Vel accusamus facere.,Finalizado,Baja,Dispositivo Nuevo,Web Corporativa,1017192,Autem ratione sed tempore.
903,analista1,37724192334,2023-12-26,CASO-00903,Dolore at a.,En revisión,Baja,Transaccional,Web Corporativa,204341,Quae iusto ut cum ex.
904,analista3,17145205461,2023-12-16,CASO-00904,Beatae rerum eligendi in consequuntur.,En revisión,Media,Ingeniería Social,App Móvil,312409,Sequi tenetur ab assumenda.
905,analista1,57684716048,2023-12-14,CASO-00905,Aliquam aut ipsum maiores.,En revisión,Alta,Dispositivo Nuevo,Banca Web,212315,Eos suscipit magni molestiae.
906,analista1,65086027855,2023-12-26,CASO-00906,Repellendus laborum blanditiis.,Finalizado,Baja,Acceso Ilegítimo,Web Corporativa,229291,Quisquam quasi maiores eum.
907,analista2,43269767791,2023-12-12,CASO-00907,Architecto asperiores delectus labore ipsum.,En revisión,Baja,Acceso Ilegítimo,App Móvil,732416,Voluptas quasi non esse.
908,analista1,60879856716,2023-12-01,CASO-00908,Quae suscipit optio adipisci.,Finalizado,Alta,Dispositivo Nuevo,Web Corporativa,1015426,At nostrum vitae a in.
909,analista1,94897195237,2023-12-02,CASO-00909,Veritatis laudantium iure.,Finalizado,Alta,Dispositivo Nuevo,Correo Electrónico,588241,Amet pariatur esse cum.
910,analista1,50757620053,2023-12-26,CASO-00910,Illo magni porro.,Finalizado,Baja,Transaccional,Correo Electrónico,666510,Quia tempora reiciendis quis.
911,analista3,29442063760,2023-12-10,CASO-00911,Magni eum officia.,Finalizado,Alta,Acceso Ilegítimo,Correo Electrónico,1198842,Delectus voluptas in nihil.
912,analista1,12886773621,2023-12-07,CASO-00912,Magnam consequuntur quasi consequuntur nisi sint.,Finalizado,Alta,Dispositivo Nuevo,App Móvil,876771,Assumenda corrupti odio.
913,analista3,14256879452,2023-12-27,CASO-00913,Libero enim qui error impedit veritatis.,Pendiente,Baja,Dispositivo Nuevo,Web Corporativa,522518,Nam quas praesentium nulla.
914,analista3,80444787698,2023-12-24,CASO-00914,Expedita sed voluptate.,Finalizado,Baja,Transaccional,App Móvil,430455,Iure ea ex voluptas quam.
915,analista3,11685409613,2023-12-01,CASO-00915,Excepturi error voluptatum.,Pendiente,Media,Ingeniería Social,Banca Web,284546,Ad odio architecto ipsam.
916,analista1,46894219875,2023-12-06,CASO-00916,Praesentium totam vero similique.,Finalizado,Alta,Transaccional,Web Corporativa,342805,Nemo sint est ducimus.
917,analista2,64157649539,2023-12-18,CASO-00917,Illo tenetur veritatis officia.,En revisión,Alta,Dispositivo Nuevo,Correo Electrónico,459194,Ipsa dolorem atque.
918,analista3,35114400253,2023-12-03,CASO-00918,Eius assumenda optio nam.,En revisión,Baja,Transaccional,Web Corporativa,1161151,Aspernatur dolor velit.
919,analista3,81039090983,2023-12-12,CASO-00919,Aperiam libero expedita itaque facilis ipsa.,En revisión,Media,Acceso Ilegítimo,Banca Web,1096613,Distinctio nam earum nam.
920,analista2,53005347070,2023-12-09,CASO-00920,Laborum exercitationem dignissimos at.,En revisión,Baja,Dispositivo Nuevo,App Móvil,818979,Eum dolor praesentium ex.
921,analista3,4476947215,2023-12-15,CASO-00921,Optio modi vel.,Finalizado,Alta,Ingeniería Social,Banca Web,797318,Atque omnis dolorum tenetur.
922,analista2,19022519976,2023-12-22,CASO-00922,Ad sapiente et dolorem voluptatem possimus.,Pendiente,Baja,Transaccional,Banca Web,391041,Distinctio modi at illo.
923,analista3,57452200683,2023-12-17,CASO-00923,Nostrum asperiores accusantium.,Finalizado,Baja,Transaccional,Correo Electrónico,69816,Eum incidunt atque sed.
924,analista1,25903186875,2023-12-27,CASO-00924,Architecto qui eligendi excepturi eum in.,En revisión,Media,Transaccional,Banca Web,374814,Aliquam animi adipisci.
925,analista3,68535979985,2023-12-25,CASO-00925,Voluptate cumque illum.,En revisión,Alta,Ingeniería Social,Banca Web,1174212,Natus consequuntur facere.
926,analista1,84403151593,2023-12-16,CASO-00926,Harum deserunt ipsa.,Pendiente,Media,Ingeniería Social,App Móvil,648688,Minus praesentium fugiat.
927,analista1,1646034372,2023-12-10,CASO-00927,Dolores deserunt deserunt.,Pendiente,Alta,Acceso Ilegítimo,Web Corporativa,522818,Placeat dicta enim soluta.
928,analista2,7446949299,2023-12-12,CASO-00928,Id explicabo eaque quam ab.,En revisión,Media,Acceso Ilegítimo,Web Corporativa,231781,Quae aspernatur iste ipsum.
929,analista2,7705271024,2023-12-20,CASO-00929,Facilis dicta alias rerum.,Pendiente,Baja,Ingeniería Social,Correo Electrónico,740676,Esse a a repellat.
930,analista3,59985972734,2023-12-04,CASO-00930,Praesentium delectus ut cum perspiciatis.,Finalizado,Baja,Acceso Ilegítimo,Web Corporativa,565459,Eos magnam et ipsam.
931,analista2,81704064884,2023-12-06,CASO-00931,Voluptatibus aliquid neque occaecati asperiores.,En revisión,Media,Dispositivo Nuevo,Correo Electrónico,385264,Nihil ipsa in voluptatibus.
932,analista3,57546039386,2023-12-02,CASO-00932,Labore nesciunt vero dignissimos.,Finalizado,Media,Transaccional,Web Corporativa,241825,At temporibus at adipisci.
933,analista3,97555372134,2023-12-19,CASO-00933,Consectetur cupiditate ratione est.,Finalizado,Baja,Transaccional,App Móvil,735492,Sed reprehenderit sit animi.
934,analista1,23081167799,2023-12-25,CASO-00934,Dolores modi placeat ab.,Finalizado,Baja,Transaccional,Banca Web,290050,Doloribus quam expedita.
935,analista2,82630984988,2023-12-25,CASO-00935,Quae quis placeat vel dolor.,Finalizado,Baja,Transaccional,Correo Electrónico,985907,Accusantium id porro.
936,analista2,11364645152,2023-12-17,CASO-00936,Dolores perferendis aut.,En revisión,Baja,Transaccional,Web Corporativa,840597,Doloremque ducimus atque.
937,analista3,99723349722,2023-12-14,CASO-00937,Doloremque sed velit.,Pendiente,Alta,Dispositivo Nuevo,Banca Web,677964,Eum a sit nihil.
938,analista3,17411241565,2023-12-15,CASO-00938,Illum sequi officia.,Pendiente,Alta,Dispositivo Nuevo,App Móvil,827337,Corrupti eaque assumenda.
939,analista2,61512881498,2023-12-13,CASO-00939,Quod debitis molestias.,Pendiente,Alta,Dispositivo Nuevo,Correo Electrónico,984781,Distinctio quod velit itaque.
940,analista1,8158230309,2023-12-12,CASO-00940,Asperiores temporibus tenetur provident.,Pendiente,Alta,Ingeniería Social,Correo Electrónico,447774,Harum at tempora corporis.
941,analista3,77421394266,2023-12-01,CASO-00941,Qui mollitia quaerat.,Pendiente,Alta,Acceso Ilegítimo,Banca Web,116385,Libero blanditiis aliquid.
942,analista1,88392796833,2023-12-06,CASO-00942,Expedita dolorum pariatur numquam.,Finalizado,Alta,Ingeniería Social,Web Corporativa,677817,Quas dolorum voluptas eos.
943,analista3,58972596732,2023-12-06,CASO-00943,Nostrum numquam libero culpa est.,Finalizado,Alta,Transaccional,Correo Electrónico,140015,Quia consequuntur eos.
944,analista1,41434156926,2023-12-20,CASO-00944,Cum inventore fuga possimus velit.,Pendiente,Media,Acceso Ilegítimo,Web Corporativa,474701,Ab quis eaque.
945,analista2,21894510771,2023-12-11,CASO-00945,Quas doloremque dicta nisi repudiandae facilis corrupti.,Pendiente,Baja,Acceso Ilegítimo,App Móvil,395473,Nam sed pariatur non modi.
946,analista2,78192001807,2023-12-28,CASO-00946,Corrupti inventore illum consectetur commodi.,Finalizado,Alta,Ingeniería Social,Banca Web,210619,Dolorum autem sint.
947,analista1,92903487047,2023-12-06,CASO-00947,Mollitia dolor aspernatur doloremque.,En revisión,Media,Acceso Ilegítimo,Correo Electrónico,1180079,Illum labore magni aliquid.
948,analista3,58673921355,2023-12-21,CASO-00948,Possimus porro perspiciatis deleniti nemo eum.,Pendiente,Media,Acceso Ilegítimo,Web Corporativa,1174062,Ullam quaerat laudantium hic.
949,analista3,4564911680,2023-12-22,CASO-00949,Commodi necessitatibus libero dolore ea.,En revisión,Baja,Transaccional,Correo Electrónico,966843,Distinctio modi doloribus.
950,analista2,18665071780,2023-12-07,CASO-00950,Animi accusamus quam cum atque accusantium.,Finalizado,Media,Acceso Ilegítimo,Web Corporativa,729138,Blanditiis velit ad dolores.
951,analista2,59059295496,2023-12-22,CASO-00951,Cumque saepe sed suscipit.,Pendiente,Baja,Acceso Ilegítimo,Web Corporativa,94185,Ea vero pariatur eveniet.
952,analista3,70523353369,2023-12-09,CASO-00952,Saepe minus quam.,En revisión,Alta,Dispositivo Nuevo,App Móvil,807081,Ipsum totam laboriosam ullam.
