ID,Usuario,CUIL_Cliente,Fecha,Caso,Descripción,Estado,Prioridad,Tipo de Riesgo,Canal de Detección,Monto Sospechoso (ARS),Observaciones
636,analista2,34420990265,2023-06-09,CASO-00636,Eveniet molestiae praesentium recusandae.,Finalizado,Media,Dispositivo Nuevo,Web Corporativa,1059012,Quam libero quam qui.
637,analista1,86194874997,2023-06-05,CASO-00637,Soluta labore accusantium ex modi error natus.,En revisión,Alta,Dispositivo Nuevo,Banca Web,788737,Ipsam fugiat animi.
638,analista3,34050079028,2023-07-27,CASO-00638,Placeat sint sed autem magnam dicta.,En revisión,Baja,Dispositivo Nuevo,Web Corporativa,191303,Odit aperiam sequi molestiae.
639,analista1,92355962058,2023-07-05,CASO-00639,Eos odio saepe molestiae laboriosam.,En revisión,Media,Transaccional,Banca Web,942820,Iusto natus velit.
640,analista3,91079716818,2023-07-07,CASO-00640,Ipsum quia esse amet totam fugiat.,Pendiente,Baja,Ingeniería Social,Web Corporativa,828422,Harum laboriosam in.
641,analista2,14611397346,2023-07-22,CASO-00641,Aspernatur deleniti ullam modi.,Finalizado,Media,Acceso Ilegítimo,Correo Electrónico,205667,Unde a dolore.
642,analista3,48085989078,2023-07-06,CASO-00642,Necessitatibus et excepturi illum.,Finalizado,Alta,Ingeniería Social,Correo Electrónico,928104,Illum iusto quae sunt.
643,analista2,81772085713,2023-07-09,CASO-00643,Ducimus repudiandae iusto perspiciatis odit.,Finalizado,Media,Transaccional,App Móvil,997264,Veniam labore repellendus.
644,analista1,92464119615,2023-07-20,CASO-00644,Accusamus doloremque reprehenderit consequuntur.,Finalizado,Baja,Transaccional,App Móvil,242284,Porro modi nihil quia.
645,analista1,94213216837,2023-07-16,CASO-00645,Autem consequatur doloremque.,Pendiente,Alta,Dispositivo Nuevo,Web Corporativa,543626,Hic laudantium placeat unde.
646,analista3,78630230963,2023-07-24,CASO-00646,Totam enim eveniet.,Pendiente,Media,Acceso Ilegítimo,Web Corporativa,61775,Tenetur unde qui hic quam.
647,analista3,74432108441,2023-07-13,CASO-00647,Facilis quas illum qui deleniti.,Finalizado,Media,Transaccional,App Móvil,1146557,Quasi aut vitae ex molestias.
648,analista1,60920520269,2023-07-02,CASO-00648,Odit iure aspernatur impedit.,Pendiente,Baja,Transaccional,App Móvil,986966,Quis dolorum occaecati velit.
649,analista1,98708821157,2023-07-24,CASO-00649,Omnis aut minima amet.,En revisión,Baja,Ingeniería Social,Web Corporativa,1180576,Minus optio quo.
650,analista3,89945155578,2023-07-09,CASO-00650,Soluta non illo animi molestiae.,Finalizado,Alta,Transaccional,Banca Web,1182928,Sed cum ullam vitae.
651,analista2,95752689305,2023-07-22,CASO-00651,Molestias necessitatibus dignissimos blanditiis repellat soluta.,En revisión,Media,Transaccional,Correo Electrónico,165048,Ut labore alias eaque.
652,analista3,45026506465,2023-07-10,CASO-00652,Rerum quaerat animi ullam.,En revisión,Media,Transaccional,Web Corporativa,782512,Cumque nesciunt dicta eum.
653,analista2,9480538781,2023-07-05,CASO-00653,Expedita impedit perferendis eligendi.,Finalizado,Alta,Ingeniería Social,Banca Web,863618,Fugit neque eum.
654,analista1,48327705731,2023-07-15,CASO-00654,Sed quidem eveniet debitis numquam debitis.,Pendiente,Media,Ingeniería Social,App Móvil,1117149,Animi dicta laboriosam optio.
655,analista2,666051009,2023-07-07,CASO-00655,Tempora corrupti libero optio.,Pendiente,Media,Dispositivo Nuevo,Correo Electrónico,508163,Rerum optio repellat veniam.
656,analista1,78748276601,2023-07-09,CASO-00656,Consequuntur eaque ullam blanditiis mollitia.,En revisión,Media,Transaccional,Web Corporativa,1169432,Dolore in veniam consectetur.
657,analista2,4395270966,2023-07-23,CASO-00657,Neque ipsum voluptatem.,Pendiente,Media,Transaccional,Correo Electrónico,578455,Saepe expedita dicta.
658,analista1,94948552035,2023-07-15,CASO-00658,Culpa facilis consequatur repellendus omnis.,En revisión,Media,Ingeniería Social,Banca Web,99049,Earum numquam impedit.
659,analista1,63052749478,2023-07-26,CASO-00659,Eligendi hic fugiat blanditiis quae.,Pendiente,Baja,Dispositivo Nuevo,App Móvil,102957,Officiis dicta sed.
660,analista2,37969768595,2023-07-20,CASO-00660,Iste sunt id ullam et.,Finalizado,Media,Ingeniería Social,Banca Web,882160,Autem est iste ullam.
661,analista3,6039107556,2023-07-28,CASO-00661,Maiores quia aperiam cum.,Pendiente,Alta,Acceso Ilegítimo,Web Corporativa,594457,Neque eligendi quia vitae ad.
662,analista2,65344240738,2023-07-06,CASO-00662,Labore amet itaque beatae.,Finalizado,Alta,Transaccional,Banca Web,377457,Saepe nemo necessitatibus.
663,analista1,98589063351,2023-07-26,CASO-00663,Iusto repellat eveniet ex corporis.,Pendiente,Baja,Ingeniería Social,Web Corporativa,319281,Consectetur libero illo iste.
664,analista2,6772509503,2023-07-18,CASO-00664,Recusandae quibusdam dicta iusto.,Finalizado,Alta,Dispositivo Nuevo,Correo Electrónico,804656,Vel ab nisi architecto iusto.
665,analista2,22785569450,2023-07-16,CASO-00665,Suscipit odit dolor repellendus.,Finalizado,Alta,Transaccional,Correo Electrónico,762431,Amet quis quae aliquid.
666,analista1,67471728897,2023-07-14,CASO-00666,Id sint suscipit iusto.,Finalizado,Media,Transaccional,App Móvil,1080504,Sapiente quidem quas ratione.
667,analista3,96264961798,2023-07-15,CASO-00667,Explicabo illo minus doloribus quisquam labore.,Pendiente,Media,Dispositivo Nuevo,Banca Web,534661,Fugiat ducimus consectetur.
668,analista3,32936162275,2023-07-11,CASO-00668,Error ab unde accusantium atque tempore.,En revisión,Media,Dispositivo Nuevo,Banca Web,447340,Maxime cumque error.
669,analista1,62837925779,2023-07-12,CASO-00669,Fugit fugiat architecto nulla ullam.,Pendiente,Alta,Transaccional,App Móvil,170333,Non alias earum ab enim.
670,analista1,21644112489,2023-07-21,CASO-00670,Expedita eos sed eius omnis enim.,Pendiente,Alta,Ingeniería Social,App Móvil,260931,Dolor voluptatum omnis.
671,analista3,31012303765,2023-07-15,CASO-00671,Nobis eius facere aperiam vel.,Finalizado,Alta,Acceso Ilegítimo,Correo Electrónico,1142849,Cum quia ullam nulla quas.
672,analista2,32932908714,2023-07-18,CASO-00672,Quo odit id impedit veniam mollitia.,Pendiente,Baja,Transaccional,Banca Web,849270,Eos dolores ratione.
673,analista2,12149505234,2023-07-07,CASO-00673,Qui non dignissimos omnis ex cupiditate.,Pendiente,Baja,Transaccional,Banca Web,1161754,Excepturi iure totam natus.
674,analista1,89187159653,2023-07-10,CASO-00674,Inventore debitis nulla occaecati pariatur ex.,Finalizado,Media,Acceso Ilegítimo,App Móvil,1115639,Inventore quae consectetur.
675,analista1,99866619529,2023-07-06,CASO-00675,Ex dolor quis sunt illum quae.,Finalizado,Alta,Acceso Ilegítimo,Banca Web,244436,At id officiis vel.
676,analista2,67233080937,2023-07-02,CASO-00676,Est ducimus asperiores aliquam soluta reiciendis.,En revisión,Media,Acceso Ilegítimo,Web Corporativa,540983,Deleniti vel assumenda illum.
677,analista2,85271417392,2023-07-01,CASO-00677,Dolore dolores quam.,Finalizado,Media,Transaccional,Correo Electrónico,539168,Explicabo quis unde delectus.
678,analista1,31082593013,2023-07-08,CASO-00678,Consequuntur iure quasi debitis.,Finalizado,Baja,Transaccional,Banca Web,591954,Est laborum cumque incidunt.
679,analista2,99176286130,2023-07-08,CASO-00679,Sint mollitia numquam.,Pendiente,Media,Acceso Ilegítimo,Banca Web,349802,A corporis eum.
680,analista3,81514640497,2023-07-06,CASO-00680,Labore voluptatum harum.,Pendiente,Alta,Transaccional,Correo Electrónico,216703,Fuga ipsum dignissimos.
681,analista3,59987448720,2023-07-17,CASO-00681,Optio facere odio eligendi.,Finalizado,Media,Ingeniería Social,Correo Electrónico,979211,Magni nihil modi fugiat nisi.
682,analista1,23797493296,2023-07-10,CASO-00682,Autem illo maxime saepe excepturi.,Pendiente,Baja,Ingeniería Social,Web Corporativa,239713,Tempora quod odit fugiat.
683,analista2,43947248881,2023-07-22,CASO-00683,Atque dolorem aut inventore sapiente officia.,Finalizado,Media,Acceso Ilegítimo,Banca Web,206176,Nostrum laborum quos esse.
684,analista3,11840843469,2023-07-20,CASO-00684,Labore dolore ullam earum sint dolore.,Pendiente,Media,Ingeniería Social,Correo Electrónico,240112,Quam porro repellat.
685,analista3,97149163662,2023-07-04,CASO-00685,Dolorem quisquam nulla officia occaecati.,En revisión,Baja,Dispositivo Nuevo,Web Corporativa,99602,Odio eius earum officia.
686,analista2,45847023015,2023-07-28,CASO-00686,Tempora natus at eaque.,Finalizado,Alta,Transaccional,Web Corporativa,877992,Commodi minus ullam officiis.
687,analista3,9177589739,2023-07-05,CASO-00687,Mollitia ullam beatae inventore alias iure.,En revisión,Media,Acceso Ilegítimo,Banca Web,551353,Quia tempore culpa.
688,analista2,22255698073,2023-07-01,CASO-00688,Numquam fugiat doloribus recusandae perferendis laborum.,En revisión,Media,Acceso Ilegítimo,Banca Web,282112,Corrupti iste accusamus non.
689,analista3,1636099515,2023-07-21,CASO-00689,Architecto delectus minus eum rerum.,En revisión,Baja,Ingeniería Social,Correo Electrónico,615525,Animi temporibus nam itaque.
690,analista3,21032801727,2023-07-16,CASO-00690,Quidem molestiae asperiores quibusdam aliquid dolorem.,Pendiente,Baja,Transaccional,App Móvil,651127,Ea eum beatae vitae ad.
691,analista3,25116544006,2023-07-01,CASO-00691,Dignissimos veritatis placeat distinctio.,En revisión,Baja,Ingeniería Social,Correo Electrónico,959687,Ipsa temporibus deleniti.
692,analista2,11611735500,2023-08-09,CASO-00692,Quae deleniti laudantium excepturi earum modi.,Finalizado,Baja,Ingeniería Social,Correo Electrónico,733229,Ullam corporis facilis optio.
693,analista3,19967374267,2023-08-24,CASO-00693,Facilis cumque velit nam voluptas.,Pendiente,Media,Transaccional,App Móvil,1024131,Ipsum ad sed cumque possimus.
694,analista3,33682748562,2023-08-18,CASO-00694,Quasi voluptas velit adipisci.,Finalizado,Alta,Transaccional,Correo Electrónico,150181,Doloribus corporis quam.
695,analista1,64018068477,2023-08-24,CASO-00695,Id labore dicta eum.,En revisión,Media,Ingeniería Social,Correo Electrónico,597952,Aperiam soluta officia.
696,analista1,25090356669,2023-08-03,CASO-00696,Voluptates fuga minima voluptatem.,Pendiente,Baja,Ingeniería Social,Correo Electrónico,1192750,Dicta maiores sed.
697,analista1,12260973077,2023-08-02,CASO-00697,Rem repudiandae necessitatibus.,Pendiente,Alta,Transaccional,Banca Web,299122,Pariatur earum hic doloribus.
698,analista2,84707964782,2023-08-06,CASO-00698,Labore rem repellendus iusto sed expedita.,En revisión,Baja,Acceso Ilegítimo,Correo Electrónico,1017985,Eius ex laborum velit fugiat.
699,analista2,88333226779,2023-08-02,CASO-00699,Hic praesentium et natus cum.,En revisión,Media,Ingeniería Social,Web Corporativa,1064372,Sequi enim sit earum.
700,analista1,21817919923,2023-08-26,CASO-00700,Est accusamus fuga corrupti eius.,Finalizado,Baja,Ingeniería Social,Web Corporativa,664378,Sapiente tempora est magnam.
701,analista3,39268554523,2023-08-21,CASO-00701,Laudantium unde nihil odio at repellat.,Finalizado,Alta,Acceso Ilegítimo,Banca Web,100895,Voluptas nulla id alias quod.
702,analista2,2155227340,2023-08-19,CASO-00702,Ut maiores omnis.,Finalizado,Alta,Ingeniería Social,Web Corporativa,327048,Quo modi eveniet voluptatem.
703,analista1,48091419954,2023-08-15,CASO-00703,Similique ut repudiandae.,Finalizado,Media,Ingeniería Social,Web Corporativa,333681,Nisi eaque ducimus maxime ea.
704,analista2,67907014659,2023-08-28,CASO-00704,Sit esse fuga blanditiis at error.,Finalizado,Media,Dispositivo Nuevo,Web Corporativa,56700,Aperiam magnam maxime.
705,analista1,99166935343,2023-08-05,CASO-00705,Cumque eos adipisci.,En revisión,Alta,Acceso Ilegítimo,App Móvil,168606,Error quis possimus error.
706,analista3,54509211845,2023-08-06,CASO-00706,Quo cum ad.,Pendiente,Baja,Ingeniería Social,Correo Electrónico,357523,Quis est dignissimos.
707,analista2,11310993024,2023-08-13,CASO-00707,Occaecati enim nam voluptate.,Pendiente,Alta,Dispositivo Nuevo,Correo Electrónico,1127036,A alias numquam voluptate.
708,analista2,70090600444,2023-08-23,CASO-00708,Ullam sequi eius veniam non laboriosam.,En revisión,Media,Dispositivo Nuevo,Banca Web,663643,Omnis dicta ipsum sunt.
709,analista2,74738512568,2023-08-20,CASO-00709,Quaerat porro possimus consequuntur quia qui.,Pendiente,Baja,Ingeniería Social,Web Corporativa,133480,Sapiente minus libero.
710,analista1,24328642531,2023-08-05,CASO-00710,Ea nam fugit minus facere.,Pendiente,Alta,Dispositivo Nuevo,App Móvil,1025324,Alias voluptatum minima ad.
711,analista2,6338287991,2023-08-27,CASO-00711,Commodi repellendus iure.,En revisión,Media,Dispositivo Nuevo,App Móvil,281187,Ut iure unde praesentium.
712,analista2,76007052447,2023-08-21,CASO-00712,Animi odit dicta fuga magnam delectus.,En revisión,Media,Ingeniería Social,Banca Web,97057,Minima modi accusamus magnam.
713,analista2,35702889920,2023-08-07,CASO-00713,Error enim maxime labore et nesciunt.,En revisión,Baja,Transaccional,App Móvil,262777,Fuga tempora magni.
714,analista3,49459188694,2023-08-03,CASO-00714,Necessitatibus eaque ratione.,En revisión,Alta,Dispositivo Nuevo,App Móvil,229391,Adipisci fugiat occaecati.
715,analista1,22300913714,2023-08-09,CASO-00715,Delectus tenetur similique commodi quam.,Finalizado,Media,Dispositivo Nuevo,App Móvil,770663,Adipisci labore enim nulla.
716,analista3,39038060918,2023-08-03,CASO-00716,Earum eligendi ipsa ratione optio.,En revisión,Baja,Dispositivo Nuevo,Correo Electrónico,431160,A quis ducimus dolore in ut.
717,analista3,81422164765,2023-08-10,CASO-00717,Adipisci iste tempora molestiae.,Pendiente,Media,Dispositivo Nuevo,Banca Web,1097195,Fugit aliquid quo dolor.
718,analista3,96965863631,2023-08-01,CASO-00718,Quas modi autem delectus cum possimus.,Pendiente,Alta,Acceso Ilegítimo,App Móvil,161823,Iste asperiores esse debitis.
719,analista3,48972184877,2023-08-02,CASO-00719,Assumenda porro modi mollitia explicabo.,Pendiente,Alta,Ingeniería Social,Banca Web,1008942,Nesciunt reiciendis ducimus.
720,analista2,14584077313,2023-08-22,CASO-00720,Inventore eligendi esse.,En revisión,Alta,Transaccional,App Móvil,179179,Provident aperiam incidunt.
721,analista2,80428019371,2023-08-05,CASO-00721,Debitis iure voluptas error quos.,Finalizado,Alta,Transaccional,Banca Web,523662,Aut nobis aliquam delectus.
722,analista2,44718981001,2023-08-01,CASO-00722,Qui magnam exercitationem accusamus.,Finalizado,Alta,Dispositivo Nuevo,App Móvil,731284,Voluptatem ea rem iste.
723,analista3,22453255554,2023-08-07,CASO-00723,Saepe inventore vero.,En revisión,Alta,Ingeniería Social,Web Corporativa,79678,Ipsum saepe aliquid.
724,analista2,18746778715,2023-08-22,CASO-00724,Fugit distinctio praesentium tempora velit consectetur.,Pendiente,Baja,Ingeniería Social,App Móvil,825239,Nisi alias porro totam alias.
725,analista2,50922305384,2023-08-08,CASO-00725,Ratione esse odit dolorum.,Finalizado,Media,Dispositivo Nuevo,Correo Electrónico,406806,A debitis minus cumque.
726,analista2,63694532393,2023-08-04,CASO-00726,Ea nobis quod.,En revisión,Baja,Ingeniería Social,Correo Electrónico,408228,Et illum molestias.
727,analista2,98702419790,2023-08-13,CASO-00727,Nisi nihil veniam accusantium iure.,Finalizado,Media,Acceso Ilegítimo,App Móvil,103174,Quam neque repellendus.
728,analista1,85000224548,2023-08-20,CASO-00728,Saepe ea quos veniam amet.,Pendiente,Media,Transaccional,Correo Electrónico,426870,Cum vel distinctio.
729,analista1,82970051801,2023-08-12,CASO-00729,Vero quod distinctio corrupti aliquam.,En revisión,Media,Dispositivo Nuevo,Web Corporativa,168168,Distinctio nisi fugiat animi.
730,analista1,29954722189,2023-08-02,CASO-00730,Accusamus accusantium sequi fugit perspiciatis.,Pendiente,Media,Dispositivo Nuevo,Banca Web,1054773,Error neque natus at.
731,analista1,30016882631,2023-08-26,CASO-00731,Architecto quae quaerat impedit reprehenderit consectetur.,En revisión,Alta,Dispositivo Nuevo,Web Corporativa,774094,Numquam earum illo magnam.
732,analista3,34710620185,2023-08-10,CASO-00732,Inventore enim hic hic doloribus.,Finalizado,Baja,Acceso Ilegítimo,Correo Electrónico,1160767,Voluptatum velit culpa.
733,analista1,74972091552,2023-08-16,CASO-00733,Corrupti nemo distinctio inventore.,Finalizado,Baja,Acceso Ilegítimo,Banca Web,1191883,Distinctio illum repellat.
734,analista1,14999381776,2023-08-04,CASO-00734,Asperiores consectetur pariatur quibusdam similique.,En revisión,Alta,Transaccional,App Móvil,168039,Autem sed facere id.
735,analista2,18310087903,2023-08-03,CASO-00735,Explicabo ipsa illo deserunt doloribus odio.,En revisión,Baja,Ingeniería Social,Web Corporativa,1035290,Minima modi non quaerat.
736,analista3,76657962727,2023-08-05,CASO-00736,Amet placeat dignissimos veritatis ea.,Pendiente,Alta,Acceso Ilegítimo,Banca Web,957861,Ipsa libero cumque iste.
737,analista1,80117578465,2023-08-08,CASO-00737,Omnis soluta vero.,Finalizado,Baja,Transaccional,Banca Web,553607,Labore sequi molestiae.
738,analista2,9580200954,2023-08-23,CASO-00738,Aliquam ipsa labore et saepe error.,Pendiente,Alta,Dispositivo Nuevo,Banca Web,599904,Ea enim rem quas perferendis.
739,analista1,15241836023,2023-08-26,CASO-00739,Nostrum maxime tempora veniam ipsum veritatis.,En revisión,Media,Transaccional,Web Corporativa,1197866,Eum eveniet rem iste.
740,analista1,26500718309,2023-08-14,CASO-00740,Facilis in vitae libero quo tempore.,En revisión,Alta,Acceso Ilegítimo,Web Corporativa,1064596,Corporis autem voluptatibus.
741,analista2,83687360233,2023-08-16,CASO-00741,Debitis dolor inventore modi nam.,En revisión,Alta,Acceso Ilegítimo,Correo Electrónico,767560,Aliquid eos aliquam.
742,analista1,26956392183,2023-08-18,CASO-00742,Eveniet alias ipsam nesciunt ex aperiam.,En revisión,Alta,Dispositivo Nuevo,Banca Web,619285,Vel similique necessitatibus.
743,analista1,32893153943,2023-08-27,CASO-00743,Aliquam exercitationem aliquid sit architecto.,Pendiente,Media,Transaccional,Correo Electrónico,420535,Tenetur hic id alias.
744,analista3,27136864876,2023-08-08,CASO-00744,Aliquid accusamus officia officiis tempore totam.,En revisión,Media,Ingeniería Social,Web Corporativa,123279,Labore quia iure quia amet.
745,analista1,67715366177,2023-08-08,CASO-00745,Neque beatae nihil placeat optio.,Pendiente,Media,Ingeniería Social,Correo Electrónico,948770,Occaecati beatae ab.
746,analista1,30693435264,2023-08-25,CASO-00746,Facilis nisi earum quam.,En revisión,Baja,Dispositivo Nuevo,App Móvil,605626,Cum quo explicabo.
747,analista1,57031088619,2023-08-08,CASO-00747,Sunt fugiat voluptate fuga.,Pendiente,Media,Acceso Ilegítimo,Web Corporativa,267621,Sed rerum nemo enim facilis.
748,analista2,98539091118,2023-08-16,CASO-00748,Inventore tempora sapiente similique porro.,En revisión,Media,Acceso Ilegítimo,Correo Electrónico,689577,Laborum autem ea eum cum.
749,analista3,15387066917,2023-08-18,CASO-00749,Inventore magnam repudiandae expedita error.,Finalizado,Media,Transaccional,Banca Web,497428,Atque soluta sequi id.
750,analista2,96428108670,2023-08-27,CASO-00750,Eos non quaerat eveniet.,Finalizado,Baja,Dispositivo Nuevo,Correo Electrónico,1154886,Commodi est eius impedit.
751,analista1,34041481480,2023-08-07,CASO-00751,Expedita quis quam tenetur.,Pendiente,Media,Acceso Ilegítimo,Correo Electrónico,727728,Quia odio tenetur iure.
752,analista3,50398639477,2023-08-21,CASO-00752,Eligendi impedit qui.,En revisión,Alta,Transaccional,Web Corporativa,405922,Soluta quibusdam odio.
753,analista3,88364380746,2023-08-17,CASO-00753,Recusandae ducimus eaque perspiciatis non.,Finalizado,Baja,Acceso Ilegítimo,Banca Web,724011,Reprehenderit culpa in.
754,analista3,42810226302,2023-08-11,CASO-00754,Quis porro dicta nesciunt provident.,En revisión,Media,Acceso Ilegítimo,Web Corporativa,963025,Enim praesentium eaque.
755,analista2,26216370681,2023-08-09,CASO-00755,Et voluptatum praesentium.,Pendiente,Baja,Ingeniería Social,Banca Web,1181086,Rem quod reprehenderit.
756,analista3,41911403354,2023-08-08,CASO-00756,Incidunt ratione quisquam perferendis earum minima.,Finalizado,Alta,Ingeniería Social,Web Corporativa,210109,Tempore vero tempore.
757,analista2,42472192782,2023-08-02,CASO-00757,Dolore necessitatibus occaecati.,Finalizado,Media,Transaccional,Correo Electrónico,805686,Iusto voluptatum nostrum.
758,analista1,81212020804,2023-08-12,CASO-00758,Consectetur eveniet eligendi.,En revisión,Alta,Ingeniería Social,Correo Electrónico,596085,Illum fugiat hic debitis hic.
759,analista1,72988571154,2023-08-20,CASO-00759,Qui harum doloremque iste dolore.,En revisión,Alta,Dispositivo Nuevo,Correo Electrónico,892794,Repellat non doloribus.
760,analista2,9466200535,2023-08-16,CASO-00760,Voluptatum id dolores ad dicta.,Pendiente,Alta,Transaccional,App Móvil,1103813,Culpa ab earum odio.
761,analista1,46662675805,2023-08-05,CASO-00761,Modi eveniet deleniti aperiam.,Pendiente,Alta,Dispositivo Nuevo,Web Corporativa,1122604,Iusto dolor ratione.
762,analista1,93439971279,2023-09-08,CASO-00762,Itaque voluptates accusamus.,Pendiente,Alta,Ingeniería Social,Correo Electrónico,245057,Minus ullam autem hic.
763,analista3,45740617645,2023-09-25,CASO-00763,Ducimus aliquid iusto aperiam.,En revisión,Alta,Dispositivo Nuevo,App Móvil,449788,Eum id sequi.
764,analista2,75872953852,2023-09-28,CASO-00764,Iste earum omnis dignissimos.,Pendiente,Media,Acceso Ilegítimo,App Móvil,296527,Distinctio illo pariatur.
765,analista1,86728263533,2023-09-18,CASO-00765,Commodi rerum ab asperiores doloribus quos.,En revisión,Alta,Ingeniería Social,Correo Electrónico,903202,Dolor odit cupiditate earum.
766,analista2,65690356045,2023-09-07,CASO-00766,Nulla quasi porro id error.,En revisión,Baja,Dispositivo Nuevo,Web Corporativa,975302,Adipisci dolorem omnis minus.
767,analista2,93865713556,2023-09-25,CASO-00767,Ea dolorum vero.,Finalizado,Baja,Transaccional,Banca Web,143578,Quasi est inventore expedita.
768,analista3,45690093995,2023-09-14,CASO-00768,Iure est molestias.,Pendiente,Media,Dispositivo Nuevo,Correo Electrónico,642375,Quos ea numquam sunt.
769,analista1,95132497723,2023-09-26,CASO-00769,In alias modi vero.,Pendiente,Media,Dispositivo Nuevo,Correo Electrónico,267595,Voluptatum ut sapiente.
770,analista1,31700065674,2023-09-13,CASO-00770,Quod sed sint ex sapiente.,Pendiente,Alta,Ingeniería Social,Web Corporativa,1098147,Sit numquam accusamus rem.
771,analista2,29648444144,2023-09-09,CASO-00771,Explicabo occaecati nisi corrupti.,Finalizado,Baja,Ingeniería Social,Correo Electrónico,591503,Ut molestiae soluta nisi.
772,analista2,84334198859,2023-09-26,CASO-00772,Totam provident veritatis exercitationem provident nemo.,Finalizado,Alta,Dispositivo Nuevo,Correo Electrónico,906971,Laboriosam ipsa dolor.
773,analista1,16133756460,2023-09-12,CASO-00773,Similique ab temporibus ut.,En revisión,Alta,Dispositivo Nuevo,Banca Web,455241,Incidunt nostrum aliquid.
774,analista2,34910259549,2023-09-11,CASO-00774,Enim assumenda ut.,Pendiente,Media,Acceso Ilegítimo,App Móvil,1057090,Quaerat quia a vitae.
775,analista2,83221739908,2023-09-16,CASO-00775,Soluta repudiandae corrupti.,En revisión,Media,Dispositivo Nuevo,Banca Web,435420,Ipsum labore mollitia.
776,analista3,48431815418,2023-09-27,CASO-00776,Placeat assumenda laboriosam explicabo.,En revisión,Media,Dispositivo Nuevo,Web Corporativa,384850,Illo et inventore.
777,analista2,10480443932,2023-09-07,CASO-00777,Ducimus animi error fugiat laborum quas.,En revisión,Media,Ingeniería Social,App Móvil,315959,Occaecati similique autem.
778,analista3,69919309536,2023-09-24,CASO-00778,Perferendis ratione veniam.,Pendiente,Baja,Acceso Ilegítimo,App Móvil,704697,Est repellat ad quas.
779,analista1,87631600210,2023-09-27,CASO-00779,Porro ut ut error neque.,En revisión,Alta,Transaccional,Banca Web,53847,Molestiae alias vel.
780,analista3,45367961040,2023-09-20,CASO-00780,Quo beatae eveniet libero facere.,Finalizado,Media,Acceso Ilegítimo,Web Corporativa,75413,Sed minus eius architecto.
781,analista3,96537989541,2023-09-22,CASO-00781,Repellat eum sapiente aperiam quas.,En revisión,Alta,Dispositivo Nuevo,Correo Electrónico,1003476,Ab sed eaque iure atque sint.
782,analista3,55993952858,2023-09-10,CASO-00782,Accusamus architecto praesentium porro cupiditate vitae.,Finalizado,Media,Transaccional,App Móvil,283364,Quo recusandae soluta a.
783,analista2,19966540874,2023-09-08,CASO-00783,Quod labore voluptas pariatur.,Finalizado,Baja,Acceso Ilegítimo,Web Corporativa,1021493,Quod sunt esse delectus.
784,analista3,60021678799,2023-09-19,CASO-00784,Deleniti quos eius explicabo saepe.,Pendiente,Media,Acceso Ilegítimo,Correo Electrónico,792748,Excepturi tempore officia.
785,analista3,75379288114,2023-09-21,CASO-00785,Tempora autem dolor quae.,Pendiente,Media,Transaccional,Banca Web,1070070,Voluptates officia nam ut.
786,analista3,92860995478,2023-09-24,CASO-00786,Iure soluta dignissimos sint sunt.,En revisión,Baja,Acceso Ilegítimo,Banca Web,848572,Vero officiis ab numquam.
787,analista2,60748356547,2023-09-27,CASO-00787,Odio nihil fugit maiores omnis.,Finalizado,Media,Transaccional,Banca Web,198034,Quod harum cum quae.
788,analista1,81827606654,2023-09-10,CASO-00788,Error ut et a a.,Pendiente,Media,Ingeniería Social,Banca Web,1140697,Nobis non ea hic aliquam.
789,analista2,24815995795,2023-09-08,CASO-00789,Iure veritatis aperiam quis.,Pendiente,Baja,Ingeniería Social,App Móvil,912832,Iure sunt itaque.
790,analista3,33632420816,2023-09-08,CASO-00790,Accusamus corrupti molestias incidunt a.,En revisión,Media,Ingeniería Social,Banca Web,926358,Esse eum esse nemo iste.
791,analista1,54643574586,2023-09-27,CASO-00791,Quo occaecati occaecati tempora error illo.,Finalizado,Baja,Acceso Ilegítimo,Web Corporativa,387306,Rem suscipit quod.
792,analista2,50307484595,2023-09-09,CASO-00792,Maxime magnam voluptate doloremque.,Pendiente,Baja,Ingeniería Social,App Móvil,343334,Fuga ad magni voluptas.
793,analista1,51152159078,2023-09-10,CASO-00793,Nisi aperiam at.,En revisión,Alta,Dispositivo Nuevo,Banca Web,430887,Dolor saepe nesciunt quod.
